,Where,Area,Sub-Area,Question,Score = 1,Score = 2,Score = 3,Score = 4
202,Diagnostic,Organisation & Staff,Organisation,How amenable is the organisation to change?,Very change resistant / No examples of change found,"Rare occurrences of change given, but almost always met with resistance by the organisation","Some change efforts undertaken, with mixed success","Clear evidence of successful change initiatives having taken place, with good approaches taken to reduce any resistance"
203,Diagnostic,Organisation & Staff,Organisation,How much has the company grown in the past 5 years?,<25%,25-50%,50-75%,>75%
204,Diagnostic,Organisation & Staff,Organisation,How often are the organisation's targets measured / evaluated to assess performance?,Never,Annually,Quarterly,Monthly
205,Diagnostic,Organisation & Staff,Organisation,How well is the organisation structure set up to deliver the strategy?,No clear linkage between staff and highly beauraucratic structure,"Some linkages, but disjointed groups and lack of clarity around hierarchy impacting effectiveness ",Clear structure but not ideal match for strategy and therefore not optimised for performance ,Clear structure which makes sense in theory and practice when considering delivery on the strategy 
206,Diagnostic,Organisation & Staff,Organisation,Mission statement exists?,No written mission or limited expression of the organisation’s reason for existence; lacks clarity or specificity; either held by very few in organisation or rarely referred to,"There is some expression of organisation’s reason for existence that reflects its values and purpose, but may lack clarity; held by only a few; lacks broad agreement or rarely referred to",There is a clear expression of organisation’s reason for existence which reflects its values and purpose; held by many within organisation and often referred to,There is a clear expression of organisation’s reason for existence which is of continued relevance that reflects its values and purpose; broadly held within organisation and frequently referred to
207,Diagnostic,Organisation & Staff,Organisation,What is the quality of internal communications channels within the organisation?,External communications are non-existent,"Limited external communications are produced, but these are done on an ad hoc basis (rather than following a strategic plan)",Good quality external communications are produced in house (linked to the organisational strategy),"Excellent, professional communications are developed by an external partner on behalf of the organisation (linked to the organisational strategy)"
208,Diagnostic,Organisation & Staff,Organisation,What proportion of last year's targets did the organisation meet (both financial and otherwise)?,<25% targets met,<50% targets met,<75% targets met,>75% targets met
209,Diagnostic,Organisation & Staff,Organisation,Which sentence best describes planning within the organisation to meet its set targets / objectives?,Organisation runs operations purely on day-to-day basis with no short- or longer-term planning activities; no experience in operational planning,Some ability and tendency to develop high-level operational plan either internally or via external assistance; operational plan loosely or not linked to strategic planning activities and used roughly to guide operations,"Ability and tendency to develop and refine concrete, realistic operational plan; some internal expertise in operational planning or access to relevant external assistance; operational planning carried out on a near regular basis; operational plan linked to strategic planning activities and used to guide operations","Organisation develops and refines concrete, realistic, and detailed operational plan; has critical mass of internal expertise in operational planning, or efficiently uses external, sustainable, highly qualified resources; operational planning exercise carried out regularly; operational plan tightly linked to strategic planning activities and systematically used to direct operations"
210,Diagnostic,Organisation & Staff,Organisation,Which sentence best describes the organisation's long term aims?,No written aims or limited expression of the organisation’s reason for existence; lacks clarity or specificity; either held by very few in organisation or rarely referred to  ,"Some expression of organisation’s reason for existence that reflects its values and purpose, but may lack clarity; held by only a few; lacks broad agreement or rarely referred to     ",Clear expression of organisation’s reason for existence which reflects its values and purpose; held by many within organisation and often referred to                      ,Clear expression of organisation’s reason for existence which is of continued relevance that reflects its values and purpose; broadly held within organisation and frequently referred to                      
211,Diagnostic,Organisation & Staff,Organisation,Which sentence best describes the organisation's strategy?,"Strategy is either nonexistent, unclear, or incoherent (a set of scattered initiatives); strategy has no influence over day-today behaviour","Strategy exists but is either not clearly linked to mission, vision, and overarching goals, or lacks coherence, or is not easily actionable; strategy is not broadly known and has limited influence over day-to-day behaviour",Coherent strategy has been developed and is linked to mission and vision but is not fully ready to be acted upon; strategy is mostly known at all levels of the organisation and day-to-day behaviour is partly driven by it,"Organisation has clear, coherent medium- to long-term strategy that is both actionable and linked to overall mission, vision, and overarching aims / goals; strategy is broadly known and consistently helps drive day to- day behaviour at all levels of organisation"
219,Diagnostic,Organisation & Staff,Staff,Are staff meeting their targets?,None of the staff are meeting their targets,Some (<50%) of the staff are meeting their targets,Most (50-75%) of the staff are meeting their targets,The vast majority of the staff (75%+) are meeting their targets
220,Diagnostic,Organisation & Staff,Staff,Are staff records maintained?,No records of staff are kept,"Records exist, but they are not regularly maintained, so there are large gaps / many details are out of date. Paper-based system in operation","Records exist and are maintained, but there may still be small gaps. Paper-based or IT system in operation","Records exist and are well maintained, with very few (if any) gaps. Paper-based or IT system in operation"
221,Diagnostic,Organisation & Staff,Staff,Are there clearly defined and formalised management reporting lines within the organisation?,No defined or formalised reporting lines in place,"Some clarity as to the reporting lines for a few areas of the organisation, but these have not been formally agreed","Reporting lines are largely agreed, although there are a few grey areas that need to be defined",Organisation-wide reporting lines defined and understood
222,Diagnostic,Organisation & Staff,Staff,"Are there systems in place to carry out, track and monitor Performance Management / appraisals and remuneration?",No appraisals given within the organisation,"There is no formal process in place, but ad hoc appraisals are given in the organisation",Standard process used. Records are paper-based but meetings are held at regular intervals ,Standard process used. Records are IT-based. Appraisals are at least quarterly 
223,Diagnostic,Organisation & Staff,Staff,"Are there systems in place to carry out, track and monitor recruitment? ",No system in place. Recruitment is ad hoc,"Yes, but the approach is very loose and not well documented. There is significant deviation from the standardised process","Yes, there is a formalised system in place. Records are either paper-based or IT-based, but are only kept during the recruitment process (unsuccessful applicant details are not retained)","Yes there is a formalised system in place. Records are IT-based, which keeps records of all applicants (including unsuccessful ones)"
224,Diagnostic,Organisation & Staff,Staff,Does the organisation have any formalised disciplinary processes?,No standard process – all ad hoc,"A loose process or definition in place, which is not necessarily documented","A documented formalised approach is used, but is only shared within the organisation when required",A documented formalised approach is used which is shared with all staff
225,Diagnostic,Organisation & Staff,Staff,How many unfilled staff positions are there?,75-100%,50-75%,25-50%,0-25%
226,Diagnostic,Organisation & Staff,Staff,How often are staff measured against their targets?,Never,Annually only,A mixture of frequencies between annually and monthly (depending on role),All are measured monthly
227,Diagnostic,Organisation & Staff,Staff,How well have staff positions been defined in terms of roles and responsibilities?,No formal definition of roles and responsibilities,Limited roles and responsibilities defined for some positions,"Clear roles and responsibilities defined, but not formally linked to objectives",Clear roles and responsibilities linked to organisational objectives and clearly communicated to the staff
228,Diagnostic,Organisation & Staff,Staff,Is there a system in place to track staff training?,No system in place,There is a paper-based record of when and what training was delivered (but not to whom),"There is a paper-based record for each individual within the organisation, detailing training attended","There is an IT system in place tracking all aspects of training for each individual within the organisation (what training attended, when and what training is still required)"
229,Diagnostic,Organisation & Staff,Staff,Is there an in-house HR function within the organisation?,No,"Yes, but delivered by non-HR professional without any training and only basic activities covered (eg,…)","Yes, but delivered by non-HR professional  with some training and with several areas of HR covered (recruitment, training)","Yes, a fully functioning HR person or small team  performing, recruitment, appraisals, disciplinary processes, training, etc."
230,Diagnostic,Organisation & Staff,Staff,What proportion of staff miss a day's work per week?,>30%,21-30%,11-20%,0-10%
231,Diagnostic,Organisation & Staff,Staff,What training is delivered to the staff?,None,Basic orientation training (on joining) only,Standardised training for main roles only. Training delivered to all,"Bespoke training plans for all employees, based on individual needs"
232,Diagnostic,Organisation & Staff,Staff,What was the level of staff turnover in the past year (including non-replaced roles)?,71-100%,41-70%,11-40%,0-10%
233,Diagnostic,Organisation & Staff,Staff,Which sentence best describes staffing within the organisation?,Staff (and/or) volunteers drawn from a narrow range of backgrounds and experiences; interest and abilities limited to present job; little ability to solve problems as they arise,"Some variety of staff (and/or) volunteer backgrounds and experiences; good capabilities, including some ability to solve problems as they arise; many interested in work beyond their current jobs and in the success of the organisation’s mission","Staff (and/or) volunteers drawn from diverse backgrounds and experiences, and bring a broad range of skills; most are highly capable and committed to mission and strategy; eager to learn and develop, and assume increased responsibility","Staff (and/or) volunteers drawn from extraordinarily diverse backgrounds and experiences, and bring broad range of skills; most staff are highly capable in multiple roles, committed both to mission/ strategy and continuous learning; most are eager and able to take on special projects and collaborate across divisional lines; staff are frequent source of ideas and momentum for improvement and innovation"
242,Diagnostic,Sales & Marketing,Competition,Do you have any actions in place to improve / counteract competition?,None,"Inward facing plan on how to improve internally, not linked to addressing competitor advantages",Plan in place to deal with generic 'competition',Full plan in place for addressing each individual competitor
243,Diagnostic,Sales & Marketing,Competition,Is the organisation performing any competitor monitoring / analysis?,Organisation is not aware of others doing similar work and has made no effort to investigate competition ,"Organisation is aware of others doing similar work, but does not know any of the details about their business","Organistion knows the competition and has some market data on them, but is not monitoring this regularly and responding to changes competitors make ","Organisation knows what competition is doing, monitors competition regularly and where appropriate makes business decisions in response to competitor actions "
244,Diagnostic,Sales & Marketing,Competition,Which sentence best describes the organisation's market research and opportunities evaluation abilities?,Organisation doesn't do any of it,Organisation does basic assessments when making business decisions,Organisation does limited market research as a matter of course to understand the situation for its existing and new products,Organisation performs robust and thorough market research as a matter of course to understand the situation for its existing and new products
271,Diagnostic,Sales & Marketing,Marketing,Does the organisation have expertise / understanding of export requirements?,None at all,The organisation knows where to take product should it want to start exporting but is unaware of the requirements ,The organisation has some knowledge of export requirements and has a track record of achieving some export successfully,Full in-house expertise and capabilities
272,Diagnostic,Sales & Marketing,Marketing,To what extent is the sales function meeting targets?,Up to 25% of target met or we don't have any targets ,Up to 50% of target met,Up to 75% of target met ,Over 75% of target met regularly 
273,Diagnostic,Sales & Marketing,Marketing,What is the quality of external communications from the organisation?,Not adherence to the laws,Minimal adherence to the laws,Adherence to most of the laws governing health and safety,Adherence to all laws governing health and safety
274,Diagnostic,Sales & Marketing,Marketing,What proportion of deliveries are on target?,Up to 25% of target met or we don't have any targets ,Up to 50% of target met,Up to 75% of target met ,Over 75% of target met regularly 
275,Diagnostic,Sales & Marketing,Marketing,What proportion of sales come from exports?,0-25%,25-50%,50-75%,75-100%
276,Diagnostic,Sales & Marketing,Marketing,What quality of distribution system does the organisation have?,No / a very limited distribution system,A basic distribution system – pick up / drop off only,"A reasonable distribution system, including tracking and warehousing",Detailed logistics and supply chain in place
277,Diagnostic,Sales & Marketing,Marketing,Which sentence best describes the organisation's marketing?,Organisation makes no or limited use of marketing; general lack of marketing skills and expertise (either internal or accessible external or expertise),Organisation takes opportunities to engage in marketing as they arise; some marketing skills and experience within staff or via external assistance,"Organisation considers marketing to be useful, and actively seeks opportunities to engage in these activities; critical mass of internal expertise and experience in marketing or access to relevant external assistance","Organisation fully aware of power of marketing activities, and continually and actively engages in them; broad pool of marketing expertise and experience within organisation or efficient use made of external, sustainable, highly qualified resources"
278,Diagnostic,Sales & Marketing,Marketing,Which sentence best describes the organisation's PR?,Organisation makes no or limited use of PR; general lack of PR skills and expertise (either internal or accessible external or expertise),Organisation takes opportunities to engage in PR as they arise; some PR skills and experience within staff or via external assistance,"Organisation considers PR to be useful, and actively seeks opportunities to engage in these activities; critical mass of internal expertise and experience in PR or access to relevant external assistance","Organisation fully aware of power of PR activities, and continually and actively engages in them; broad pool of PR expertise and experience within organisation or efficient use made of external, sustainable, highly qualified resources"
296,Diagnostic,General Company Info,General Company Info,What are the key areas your enterprise needs assistance with?,,,,
