,Where,Area,Sub-Area,Question,Score = 1,Score = 2,Score = 3,Score = 4
1,Diagnostic,Environmental & Social Impact,Environmental,"Does the enterprise understand the significant positive environmental impacts of its activities, for example, low energy consumption, energy sourced from renewables, product is renewable/efficient energy technology, high standard of environmental policies, sustainable farming practices etc.? ",The enterprise does not focus on this. It is possible that is has little or low positive environmental impact,The enterprise is aware of its positive impact. It is possible that positive impact is created as a side effect of its main activities,"The enterprise is aware of its impact, has taken action to focus on creating more impact and trying to measure it, but it’s not comprehensive",The enterprise is focused on its social impact. Actions to ensure and increase impact are taken and monitored by management. Impact is measured and reported
2,Diagnostic,Environmental & Social Impact,Environmental,"Does the enterprise understand what negative impact its activities have on the environment, for example in terms of pollution, high water consumption and deforestation?",The enterprise has not analysed this. It is possible that its activities are damaging,"The enterprise is aware of its environmental impact and has taken action on one or two of the issues, such as reduction of chemicals","The enterprise is aware of its impact, has received advice on some of these issues, and has taken actions, but it’s not comprehensive",The enterprise carries out a full diagnostic involving local stakeholders and covering a wide range of issues from water to conservation. Actions are taken and monitored by management
3,Diagnostic,Environmental & Social Impact,Social,"Does the enterprise understand the significant positive social impacts of its activities, for example, employment creation, good worker conditions, training, community development etc.?",The enterprise does not focus on this. It is possible that is has little or low positive social impact,The enterprise is aware of its positive impact. It is possible that positive impact is created as a side effect of its main activities,"The enterprise is aware of its impact, has taken action to focus on creating more impact and trying to measure it, but it’s not comprehensive",The enterprise is focused on its social impact. Actions to ensure and increase impact are taken and monitored by management. Impact is measured and reported
4,Diagnostic,Environmental & Social Impact,Social,"Does the enterprise understand what negative impacts its activities may have on society, for example in terms of poor working conditions, no community interaction, low involvement of women in enterprise, product unsuitable for local people (luxury market etc.)? ",The enterprise has not analysed this. It is possible that its activities are damaging,"The enterprise is aware of its negative social impact and has taken action on one or two of the issues, such as improving health and safety or giving workers fair pay","The enterprise is aware of its impact, has received advice on some of these issues, and has taken actions, but it’s not comprehensive",The enterprise carries out a full diagnostic involving local stakeholders and covering a wide range of issues from gender inclusion to product suitability. Actions are taken and monitored by management
13,Diagnostic,Finance & Legal,Compliance,How often do organisational audits occur?,Never,"Irregularly, every few years",Regularly every 2 years or so,Regularly (annually / more frequently)
14,Diagnostic,Finance & Legal,Compliance,What is the level of adherence to employment laws,No regular meetings,Annually,Twice annually - Quarterly,Monthly
15,Diagnostic,Finance & Legal,Compliance,What is the level of adherence to health and safety laws,Not adherence to the laws,Minimal adherence to the laws,Adherence to most of the laws governing employment,Adherence to all laws governing employment
16,Diagnostic,Finance & Legal,Compliance,What is the level of adherence to tax laws,Not adherence to the laws,Minimal adherence to the laws,Adherence to most of the laws governing health and safety,Adherence to all laws governing health and safety
36,Diagnostic,Finance & Legal,Finance,Are there systems in place for processing finances?,No systems in place,"System in place, but processes are undocumented",Paper-based system in place and all processes documented,IT-based system in place and all processes documented
37,Diagnostic,Finance & Legal,Finance,Does the organisation have access to loans  / working capital?,"No, none and it has been refused by several banks and other formal sector money lenders","Small, expensive loans available to the organisation with slow approval times and may not be granted",Organisation has an established track record with a bank and is now able to access slightly larger amounts of capital at lower rates than before. It is unlikely an application would be delayed or refused,"Yes, organisation has overdraft facility sufficient for its current trading pattern "
38,Diagnostic,Finance & Legal,Finance,How advanced are the Financial Reporting activities?,Limited / non-existent reports,Basic reports in place,Some areas of depth - good general reports,Excellent throughout
39,Diagnostic,Finance & Legal,Finance,How often are management financial reports produced?,Never,Annually,Quarterly,Monthlly
40,Diagnostic,Finance & Legal,Finance,Is there an in-house finance function within the organisation?,No,"Yes, book-keeping only","Yes, book-keeping and creation of monthly management accounts","Yes, book-keeping, creation of monthly management and annual accounts"
41,Diagnostic,Finance & Legal,Finance,Trades Payable - is the organisation paying its creditors on time (to agreed terms)?,0-50% on time,<75% on time,<90% on time,>90% on time
42,Diagnostic,Finance & Legal,Finance,Trades Receivable - is the organisation getting monies owed by debtors / customers paid within agreed terms?,0-50% on time,<75% on time,<90% on time,>90% on time
43,Diagnostic,Finance & Legal,Finance,What is this year's PnL projection?,Less than 25% capacity ,Less than 50% capacity ,Less than 75% capacity ,Consistently more than 75% capacity 
44,Diagnostic,Finance & Legal,Finance,"What level of financial reserves does the organisation have? Or cash until next revenue generation event (eg, harvest)?","None, few or it is not clear at this time ",1 month's operating costs in cash at bank on average month on month,2 month's operating costs in cash at bank on average month on month ,3+ month's operating costs in cash at bank on average month on month
45,Diagnostic,Finance & Legal,Finance,Which sentence best describes the organisation's revenue generation model?,Single product,"Multiple product lines on same platform
(eg, one organisation producing ready salted peanuts and dry roasted peanuts, in 100g bags and 1kg bags)","Multiple platforms each with single product lines 
(eg, one organisation manufacturing one type of football, tennis racket and screwdriver)","Multiple product lines within multiple platforms
(eg, an organisation that produces multiple PCs, laptops and printers) "
46,Diagnostic,Finance & Legal,Finance,What is the 3 year trend of total revenues?,"Large, consistent declines",Some net decline,Some net growth,"Strong, consistent growth"
47,Diagnostic,Finance & Legal,Finance,What is the 3 year trend of percentage of revenues concentrated in top 5 customers (revenue from customer/total gross revenue)?,"Significant, consistent concetration",Some net concentration,Some net diversification,"Strong, consistent diversification"
48,Diagnostic,Finance & Legal,Finance,What is the 3 year trend of gross margin?,"Large, consistent declines",Some net decline,Some net growth,"Strong, consistent growth"
49,Diagnostic,Finance & Legal,Finance,What is the 3 year trend of net margin?,"Large, consistent declines",Some net decline,Some net growth,"Strong, consistent growth"
50,Diagnostic,Finance & Legal,Finance,What is the 3 year trend of assets employed?,"Large, consistent declines",Some net decline,Some net growth,"Strong, consistent growth"
51,Diagnostic,Finance & Legal,Finance,What is the 3 year trend of the current ratio?,"Large, consistent decline in liquidity",Some net decline in liquidity,Some net growth in liquidity,"Strong, consistent growth in liquidity"
52,Diagnostic,Finance & Legal,Finance,What is the 3 year trend of equity concentrated in the owner?,"Significant, consistent concetration",Some net concentration,Some net diversification,"Strong, consistent diversification"
53,Diagnostic,Finance & Legal,Finance,What is the 3 year trend of debt/equity ratio?,Extreme changes in ratio,Significant change in ratio,Mostly consistent ratio,Stable ratio
54,Diagnostic,Finance & Legal,Finance,What is the 3 year trend of cash generated from operations?,"Large, consistent declines",Some net decline,Some net growth,"Strong, consistent growth"
89,Diagnostic,Finance & Legal,Legal,To what extent is there an in-house legal capability within the organisation?,None,Basic contracts for suppliers and sales only,"Basic contracts for suppliers and sales, internal contracts (eg, employment, health & safety)",Complex internal and external capabilities (including corporate and commercial legal work)
90,Diagnostic,Finance & Legal,Legal,What access do you have to external legal support?,Nascent,Emerging,Expanding,Mature
91,Diagnostic,Finance & Legal,Legal,What insurance and intellectual property (IP) coverage do you have?,Very limited or no insurance/IP coverage,Limited insurance/IP coverage,Good insurance/IP coverage,"Full, extensive insurance/IP coverage"
92,Diagnostic,Finance & Legal,Legal,"Are there any ongoing, or have there been any legal disputes within the past 5 years?","Yes, there have been several disputes over different issues","Yes, there have been several disputes in one area","Yes, there has been one dispute",No disputes
116,Diagnostic,Leadership,Governance,*Cooperatives only* - What is the quality of the general assembly?,Very poor. Little or no skills or experience of working within an effective general assembly,Poor. A few experienced people within the general assembly drive it to make the assembly work,Good. A large proportion of the assembly have the skills and experience required for an effective general assembly,Excellent. The vast majority of the assembly have the skills and experience to create a highly effective general assembly
117,Diagnostic,Leadership,Governance,Are the board fully informed on all matters regarding the running of the organisation? ,No updates given,Updates are only given on a need to know basis,"Reports are provided to the board, but are done so irregularly / not in a standard format",Regular reports provided in a standardised format
118,Diagnostic,Leadership,Governance,Does the board have the expertise to advise on all matters?  ,"Board has a limited expertise, with large gaps in skills","Board has a few areas of expertise, but has several gaps in skills","Board has no gaps, but has only limited skills in some areas ",Board has expertise in all areas
119,Diagnostic,Leadership,Governance,Does the board provide direction to organisation leadership when sought? ,No direction provided,"Direction provided by board, but only after being prompted repeatedly by leadership","Direction provided by board, but leadership has to ask for input",Direction provided by board without prompting
120,Diagnostic,Leadership,Governance,How well have board positions been defined in terms of roles and responsibilities (against those of the leadership team)?,"No definition of roles and responsibilities, resulting in much overlap with the leadership, causing confusion over the respective roles","Limited definition of roles and responsibilities, but these need revising as there are clear overlaps with the leadership","Roles and responsibilities have been defined, but there are still some grey areas that need resolution","Roles and responsibilities are clear, with the differentiation understood by both board and leadership"
121,Diagnostic,Leadership,Governance,What is the frequency of board meetings?,No utilities on site,Frequent outages interrupting business activities (daily outages),Still experience a few outages which interrupt business operations (no more than one outage a week),All utilities have no outages / backup options in place
122,Diagnostic,Leadership,Governance,What is the relationship like between board and leadership?,No internal communications in place,Limited communications within the organisation that are done on an ad hoc basis,"Some internal communications are produced (following a standard approach), but which are not produced with any regularity","A standardised approach is used for internal communications, which are produced on a regular basis"
125,Diagnostic,Leadership,Management,Are all key / senior roles filled?   ,"No, several key positions are unfilled",There are two or three key positions unfilled,There is one key position that is unfilled at present,There are no empty key positions
126,Diagnostic,Leadership,Management,Assess the organisation's CEO/Exec Director and Senior Management Team for their ability to focus on achieving results within the organisation,Little or none,"Some, but basic","Established, but developing",Fully fledged and strong
127,Diagnostic,Leadership,Management,Assess the organisation's CEO/Exec Director and Senior Management Team for their ability to think strategically / analytically about issues,Little or none,"Some, but basic","Established, but developing",Fully fledged and strong
128,Diagnostic,Leadership,Management,Assess the organisation's CEO/Exec Director and Senior Management Team for their financial judgement / expertise,Little or none,"Some, but basic","Established, but developing",Fully fledged and strong
129,Diagnostic,Leadership,Management,Assess the organisation's CEO/Exec Director and Senior Management Team for their leadership skills,Little or none,"Some, but basic","Established, but developing",Fully fledged and strong
130,Diagnostic,Leadership,Management,Assess the organisation's CEO/Exec Director and Senior Management Team for their passion and vision,Little or none,"Some, but basic","Established, but developing",Fully fledged and strong
131,Diagnostic,Leadership,Management,"Assess the organisation's CEO/Exec Director and Senior Management Team for their relationship with staff members (trust, respect, rapport)",Little or none,"Some, but basic","Established, but developing",Fully fledged and strong
132,Diagnostic,Leadership,Management,Assess the organisation's CEO/Exec Director and Senior Management Team for their reputation within the organisation,Little or none,"Some, but basic","Established, but developing",Fully fledged and strong
133,Diagnostic,Leadership,Management,How dependent is the organisation on the existing CEO? ,Organisation will fail quickly without the CEO,"Will cope short term, but will struggle to survive long term without the CEO","Will survive long term, but not as well as when with the current CEO",Organisation will continue strongly without the existing CEO
134,Diagnostic,Leadership,Management,How experienced are the CEO / Senior Management team?,<1 year,1-5 years,6-10 years,10+ years
135,Diagnostic,Leadership,Management,Is there succession planning in place for key positions within the organisation?,No,,,Yes
136,Diagnostic,Leadership,Management,What proportion of people in key / senior roles left the organisation within the past 12 months?,75-100%,50-75%,25-50%,0-25%
141,Diagnostic,Operations & Procurement,Facilities,How secure are the premises?,No security. Major issue. High risk,Limited security - breaches have occurred in the past. Some risk,Security ok - possibly a rare breach in the past. Limited risk,Excellent security. Minimum risk
142,Diagnostic,Operations & Procurement,Facilities,"How suitable is the current equipment (non-manufacturing related equipment) to conduct the organisation's business activities? (eg, computers)",Totally unsuitable for effective working of the organisation. No amount of correction will make them suitable,Major problems in the equipment need to be addressed in order for them to be suitable and enable effective working,The equipment is suitable for the organisation's business activities. Minor problems need to be addressed,The equipment is highly suitable for the organisation's business activities. No noticeable problems present
143,Diagnostic,Operations & Procurement,Facilities,"How suitable is the current manufacturing equipment to conduct the organisation's business activities? (eg, processing machinery, refrigeration units)",Totally unsuitable for effective working of the organisation. No amount of correction will make them suitable. Replacement is required,Major problems in the equipment need to be addressed in order for them to be suitable and enable effective working,The equipment is suitable for the organisation's business activities. Minor problems need to be addressed,The equipment is highly suitable for the organisation's business activities. No noticeable problems present
144,Diagnostic,Operations & Procurement,Facilities,"What is the availability of utilities? (eg, electricity, phone lines, internet)",Up to 25% of the team have access to hardware who need it,Up to 50% of the team have access to hardware who need it,Up to 75% of the team have access to hardware who need it,Over 75% of the team have access to hardware who need it
145,Diagnostic,Operations & Procurement,Facilities,"What is the standard of the premises? (eg, what were the results of a health and safety inspection, or audit of facilities)","Poor relationship between board and leadership, with the groups in constant conflict","Average relationship between board and leadership, where there are regular conflicts between the groups","Good relationship between board and leadership, although there are occasional issues which cause friction between the two groups","Excellent relationship between board and leadership, with both groups working well together to the benefit of the organisation"
152,Diagnostic,Operations & Procurement,IT/Technology,Are there IT implementation projects occurring within the organisation?,No ,The organisation wants to upgrade software on existing terminals ,The organisation is trying to install a server and run software from it ,"Yes, the organisation has identified an IT capability which it can afford or has procured and it is being implemented "
153,Diagnostic,Operations & Procurement,IT/Technology,Does the organisation have an in-house support function?,No,Informal basic knowledge of IT,One or more of the team have reasonable IT skills ,Yes
154,Diagnostic,Operations & Procurement,IT/Technology,Does the organisation use IT?,No,Limited use,Most departments use IT,Yes all areas / departments use IT
155,Diagnostic,Operations & Procurement,IT/Technology,"How adequate are IT procedures such as back up, anti virus protection, version control, etc?",None existent,Some protection and back up procedures exist,"The organisation has a reasonably systematic approach to protection and back up, but it is a manual process ",Full procedures implemented - no issues
156,Diagnostic,Operations & Procurement,IT/Technology,How adequate is the software being used by the organisation to perform business tasks?,Totally inadequate - too old / unsuitable and crashing a lot ,The software is old but reasonably reliable and not in need of necessary revision ,The software is quite new and enables most business requirements to be met ,Fit for all business processes
157,Diagnostic,Operations & Procurement,IT/Technology,How dependent is the organisation on IT?,"Not at all, there is minimal or no use of IT or mobile phones",The organisation runs book keeping and other back office functions on IT and some front office features like email ,The organisation uses IT in most of its functions both front and back office ,The organisation has invested heavily in IT and is using it in all aspects of its business 
158,Diagnostic,Operations & Procurement,IT/Technology,What is the age of IT hardware within the organisation?,Nascent,Emerging,Expanding,Mature
159,Diagnostic,Operations & Procurement,IT/Technology,What is the amount of IT hardware in the organisation? ,Over 4 years old,2-4 years old,1-2 years old,Up to 1 year old
169,Diagnostic,Operations & Procurement,Processes,Does the organisation have quality & compliance systems in place?,No,,,Yes
170,Diagnostic,Operations & Procurement,Processes,Is there an in-house manufacturing function within the organisation?,No - not applicable,,,Yes
171,Diagnostic,Operations & Procurement,Processes,To what extent are you meeting quality & compliance targets?,Up to 25% of target met or we don't have any targets ,Up to 50% of target met,Up to 75% of target met ,Over 75% of target met regularly 
172,Diagnostic,Operations & Procurement,Processes,What are the error rates like?,More than 75% ,More than 50%,More than 25%,Consistenly under 25% 
173,Diagnostic,Operations & Procurement,Processes,What are the frequency of breakdowns / lost productivity due to machinery problems?,Every day productivity is lost due to machinery problems with the old machinery the organisation is using ,"Weekly, the organisation loses productivity due to machinery problems ","Monthly, the organisation loses productivity due to machinery problems ",Machinery problems are infrequent and the organisation maintains its machines well 
174,Diagnostic,Operations & Procurement,Processes,What is the volume of production?,Totally unsuitable for effective working of the organisation. No amount of correction will make them suitable,Major problems within the premises need to be addressed in order for them to be suitable for the organisation and enable effective working,The premises are suitable for the organisation. Minor problems need to be addressed,The premises are highly suitable for the organisation. No noticeable problems present
175,Diagnostic,Operations & Procurement,Processes,"Are standard business processes for working created, documented and used by workforce?",No standard processes are followed or documented,"Only key / core business processes are standardised, documented and followed by the organisation","Most business processes are standardised, documented and followed by the organisation","All business processes are standardised, documented and followed by the organisation"
185,Diagnostic,Operations & Procurement,Procurement,"Are there issues with the raw material supply (ie, on time, availability)?",Delivery of raw materials is often delayed or not available,Raw materials are sometimes late arriving or there are sometimes shortages, Raw materials occasionally arrive late or are unavailable, Late delivery very rarely happens and there is no problem with availability   
186,Diagnostic,Operations & Procurement,Procurement,Are there issues with the raw materials cost?,The cost of raw materials is going up quickly or is constantly changing by large margins making it difficult to know when to buy,The cost of raw materials is rising steadily or is fluctuating in a reasonably regular way ,The cost of raw materials is rising a little bit or there are some minor fluctuations in price of raw materials which the organisation is able to predict,The cost of raw materials is remaining constant and the price is very manageable for the organisation 
187,Diagnostic,Operations & Procurement,Procurement,Are there issues with the raw materials quality?,Quality of raw materials is consistently a problem ,Quality of raw materials is sometimes a problem,Occassionally there are problems with the quality of raw materials,There are only minor problems with raw material quality
188,Diagnostic,Operations & Procurement,Procurement,Is there an in-house procurement function within the organisation?,No,Informal ,"It is part of one of the senior managers' responsibilities, but there is no official function ",Yes
197,Diagnostic,Organisation & Staff,Organisation,Are targets formally set in the organisation?,No targets are set,"Yes, but only at an organisational level","Yes, at both organisational and team levels","Yes, at organisational, team and individual levels"
198,Diagnostic,Organisation & Staff,Organisation,"Are the organisation's targets linked to aims, vision and mission statement?",No - not at all,There are some links,"They are largely linked, but some gaps",All elements are completely linked
199,Diagnostic,Organisation & Staff,Organisation,"Are the organisation's targets SMART (Specific, Measurable, Achievable, Relevant, Timely)?",No - none of the targets are SMART,"Some of the targets are SMART, but there are areas which aren't",Most of the targets are SMART,All the targets are SMART
200,Diagnostic,Organisation & Staff,Organisation,Are there systems in place for planning / project management?,No systems in place,"Yes, but it is an undocumented basic paper-based approach, done by a handful of employees (not everyone who needs to use it)","Yes, it is a well-documented paper-based approach, understood by a large number of the people in the organisation who need to use it","Yes, an IT-based approach is in place, understood by everyone who needs to use it in the organisation"
201,Diagnostic,Organisation & Staff,Organisation,Does a statement of the organisation's vision exist?,No written vision exists,"Yes, but can only be verbalised amongst the senior leadership","Yes, can be verbalised amongst entire leadership and management group","Yes, the entire organisation can verbalise the organisation's vision"
